{
  "schemaVersion": 1,
  "id": "hikma-starter-2026-10-25",
  "title": "智慧宫 · 外交与社会入门",
  "knowledge": [
    {
      "id": "secular",
      "arabic": "الْعَلْمَانِيُّ",
      "meaning": "世俗主义的；世俗主义者",
      "root": "ع ل م",
      "form": "关系形容词（نِسْبَة）；与 الْعِلْمِيُّ（科学的）区分",
      "collocations": ["النِّظَامُ الْعَلْمَانِيُّ"],
      "examples": [
        {
          "arabic": "يُؤَكِّدُ الدُّسْتُورُ الطَّابَعَ الْعَلْمَانِيَّ لِلدَّوْلَةِ.",
          "chinese": "宪法确认国家的世俗性质。"
        }
      ],
      "grammar": "形容词须与被修饰名词在性、数、格和确定性上配合。",
      "confusion": "注意语境中是形容词还是指人；“科学的”读作 عِلْمِيّ。",
      "scenario": "注意语境中是形容词还是指人；“科学的”读作 عِلْمِيّ。",
      "date": "2026-10-25",
      "category": "政治与社会",
      "pauseNote": "停顿时通常不读末尾的短元音和格尾；连续读法保留语法要求的格尾。阴性词尾 ة 停顿时通常读作 h，连读时读作 t。"
    },
    {
      "id": "azeri",
      "arabic": "الْأَذَرِيُّ",
      "meaning": "阿塞拜疆族的；阿塞拜疆族人",
      "root": "—",
      "form": "民族名称的关系形容词",
      "collocations": ["اللُّغَةُ الْأَذَرِيَّةُ"],
      "examples": [
        {
          "arabic": "يَتَحَدَّثُ صَدِيقِي اللُّغَةَ الْأَذَرِيَّةَ.",
          "chinese": "我的朋友说阿塞拜疆语。"
        }
      ],
      "grammar": "形容词须与被修饰名词在性、数、格和确定性上配合。",
      "confusion": "族群与国籍需区分，国籍也常用 أَذْرَبَيْجَانِيّ。",
      "scenario": "族群与国籍需区分，国籍也常用 أَذْرَبَيْجَانِيّ。",
      "date": "2026-10-25",
      "category": "文化与社会",
      "pauseNote": "停顿时通常不读末尾的短元音和格尾；连续读法保留语法要求的格尾。阴性词尾 ة 停顿时通常读作 h，连读时读作 t。"
    },
    {
      "id": "cooperate",
      "arabic": "تَكَاتُفُ الْجُهُودِ",
      "meaning": "齐心协力；各方共同努力",
      "root": "ك ت ف",
      "form": "第六式动名词；正偏组合",
      "collocations": ["تَكَاتُفُ الْجُهُودِ الدَّوْلِيَّةِ"],
      "examples": [
        {
          "arabic": "يَتَطَلَّبُ السَّلَامُ تَكَاتُفَ الْجُهُودِ.",
          "chinese": "和平需要各方共同努力。"
        }
      ],
      "grammar": "正偏组合中，后项用属格；前项随句法位置变化。",
      "confusion": "可译为“凝聚合力”；按语境处理共同努力的主体。",
      "scenario": "可译为“凝聚合力”；按语境处理共同努力的主体。",
      "date": "2026-10-25",
      "category": "外交表达",
      "pauseNote": "停顿时通常不读末尾的短元音和格尾；连续读法保留语法要求的格尾。阴性词尾 ة 停顿时通常读作 h，连读时读作 t。",
      "verb": {
        "past": "تَكَاتَفَ",
        "present": "يَتَكَاتَفُ",
        "masdar": "تَكَاتُفٌ"
      }
    },
    {
      "id": "harmony",
      "arabic": "الْوِئَامُ",
      "meaning": "和谐；和睦",
      "root": "و أ م",
      "form": "名词",
      "collocations": ["الْوِئَامُ الِاجْتِمَاعِيُّ"],
      "examples": [
        {
          "arabic": "يَسْعَى الْجَمِيعُ إِلَى الْعَيْشِ فِي وِئَامٍ.",
          "chinese": "所有人都追求和睦相处。"
        }
      ],
      "grammar": "常与介词 فِي 连用，表示处于和睦状态。",
      "confusion": "وِئَام 侧重和睦关系；سَلَام 也可指和平或安宁。",
      "scenario": "وِئَام 侧重和睦关系；سَلَام 也可指和平或安宁。",
      "date": "2026-10-25",
      "category": "外交表达",
      "pauseNote": "停顿时通常不读末尾的短元音和格尾；连续读法保留语法要求的格尾。阴性词尾 ة 停顿时通常读作 h，连读时读作 t。"
    },
    {
      "id": "ceremony",
      "arabic": "مَرَاسِمُ الِاسْتِقْبَالِ",
      "meaning": "欢迎仪式",
      "root": "ر س م / ق ب ل",
      "form": "مَرَاسِم 为复数；正偏组合",
      "collocations": ["مَرَاسِمُ الِاسْتِقْبَالِ الرَّسْمِيَّةُ"],
      "examples": [
        {
          "arabic": "بَدَأَتْ مَرَاسِمُ الِاسْتِقْبَالِ فِي الصَّبَاحِ.",
          "chinese": "欢迎仪式于上午开始。"
        }
      ],
      "grammar": "正偏组合中，后项用属格；前项随句法位置变化。",
      "confusion": "مَرَاسِم 是仪式、礼仪；与 رُسُوم（费用、图画）区分。",
      "scenario": "مَرَاسِم 是仪式、礼仪；与 رُسُوم（费用、图画）区分。",
      "date": "2026-10-25",
      "category": "外交礼宾",
      "pauseNote": "停顿时通常不读末尾的短元音和格尾；连续读法保留语法要求的格尾。阴性词尾 ة 停顿时通常读作 h，连读时读作 t。"
    },
    {
      "id": "guard",
      "arabic": "حَرَسُ الشَّرَفِ",
      "meaning": "仪仗队",
      "root": "ح ر س / ش ر ف",
      "form": "集合名词 حَرَس；正偏组合",
      "collocations": ["اِسْتِعْرَاضُ حَرَسِ الشَّرَفِ"],
      "examples": [
        {
          "arabic": "اِسْتَعْرَضَ الرَّئِيسُ حَرَسَ الشَّرَفِ.",
          "chinese": "总统检阅了仪仗队。"
        }
      ],
      "grammar": "正偏组合中，后项用属格；前项随句法位置变化。",
      "confusion": "“检阅仪仗队”惯用 اِسْتَعْرَضَ حَرَسَ الشَّرَفِ。",
      "scenario": "“检阅仪仗队”惯用 اِسْتَعْرَضَ حَرَسَ الشَّرَفِ。",
      "date": "2026-10-25",
      "category": "外交礼宾",
      "pauseNote": "停顿时通常不读末尾的短元音和格尾；连续读法保留语法要求的格尾。阴性词尾 ة 停顿时通常读作 h，连读时读作 t。"
    },
    {
      "id": "courtesy",
      "arabic": "زِيَارَةُ مُجَامَلَةٍ",
      "meaning": "礼节性拜访",
      "root": "ز و ر / ج م ل",
      "form": "正偏组合，مُجَامَلَة 为第三式动名词",
      "collocations": ["الْقِيَامُ بِزِيَارَةِ مُجَامَلَةٍ"],
      "examples": [
        {
          "arabic": "قَامَ السَّفِيرُ بِزِيَارَةِ مُجَامَلَةٍ لِلْوَزِيرِ.",
          "chinese": "大使对部长进行了礼节性拜访。"
        }
      ],
      "grammar": "正偏组合中，后项用属格；前项随句法位置变化。",
      "confusion": "不要机械译成“恭维访问”；外交礼宾中指礼节性拜访。",
      "scenario": "不要机械译成“恭维访问”；外交礼宾中指礼节性拜访。",
      "date": "2026-10-25",
      "category": "外交礼宾",
      "pauseNote": "停顿时通常不读末尾的短元音和格尾；连续读法保留语法要求的格尾。阴性词尾 ة 停顿时通常读作 h，连读时读作 t。"
    }
  ],
  "questions": [
    {
      "id": "secular-choice",
      "knowledgeId": "secular",
      "type": "zh-ar",
      "prompt": "请选择“世俗主义的；世俗主义者”对应的阿语。",
      "options": ["الْعَلْمَانِيُّ", "الْأَذَرِيُّ", "الْوِئَامُ"],
      "answer": "الْعَلْمَانِيُّ",
      "explanation": "注意语境中是形容词还是指人；“科学的”读作 عِلْمِيّ。"
    },
    {
      "id": "secular-translate",
      "knowledgeId": "secular",
      "type": "ar-zh",
      "prompt": "翻译：يُؤَكِّدُ الدُّسْتُورُ الطَّابَعَ الْعَلْمَانِيَّ لِلدَّوْلَةِ.",
      "answer": "宪法确认国家的世俗性质。",
      "explanation": "形容词须与被修饰名词在性、数、格和确定性上配合。",
      "rubric": ["核心含义准确", "句法关系清晰", "中文自然，符合使用场景"]
    },
    {
      "id": "azeri-choice",
      "knowledgeId": "azeri",
      "type": "zh-ar",
      "prompt": "请选择“阿塞拜疆族的；阿塞拜疆族人”对应的阿语。",
      "options": [
        "الْأَذَرِيُّ",
        "تَكَاتُفُ الْجُهُودِ",
        "مَرَاسِمُ الِاسْتِقْبَالِ"
      ],
      "answer": "الْأَذَرِيُّ",
      "explanation": "族群与国籍需区分，国籍也常用 أَذْرَبَيْجَانِيّ。"
    },
    {
      "id": "azeri-translate",
      "knowledgeId": "azeri",
      "type": "ar-zh",
      "prompt": "翻译：يَتَحَدَّثُ صَدِيقِي اللُّغَةَ الْأَذَرِيَّةَ.",
      "answer": "我的朋友说阿塞拜疆语。",
      "explanation": "形容词须与被修饰名词在性、数、格和确定性上配合。",
      "rubric": ["核心含义准确", "句法关系清晰", "中文自然，符合使用场景"]
    },
    {
      "id": "cooperate-choice",
      "knowledgeId": "cooperate",
      "type": "zh-ar",
      "prompt": "请选择“齐心协力；各方共同努力”对应的阿语。",
      "options": ["تَكَاتُفُ الْجُهُودِ", "الْوِئَامُ", "حَرَسُ الشَّرَفِ"],
      "answer": "تَكَاتُفُ الْجُهُودِ",
      "explanation": "可译为“凝聚合力”；按语境处理共同努力的主体。"
    },
    {
      "id": "cooperate-translate",
      "knowledgeId": "cooperate",
      "type": "ar-zh",
      "prompt": "翻译：يَتَطَلَّبُ السَّلَامُ تَكَاتُفَ الْجُهُودِ.",
      "answer": "和平需要各方共同努力。",
      "explanation": "正偏组合中，后项用属格；前项随句法位置变化。",
      "rubric": ["核心含义准确", "句法关系清晰", "中文自然，符合使用场景"]
    },
    {
      "id": "harmony-choice",
      "knowledgeId": "harmony",
      "type": "zh-ar",
      "prompt": "请选择“和谐；和睦”对应的阿语。",
      "options": [
        "الْوِئَامُ",
        "مَرَاسِمُ الِاسْتِقْبَالِ",
        "زِيَارَةُ مُجَامَلَةٍ"
      ],
      "answer": "الْوِئَامُ",
      "explanation": "وِئَام 侧重和睦关系；سَلَام 也可指和平或安宁。"
    },
    {
      "id": "harmony-translate",
      "knowledgeId": "harmony",
      "type": "ar-zh",
      "prompt": "翻译：يَسْعَى الْجَمِيعُ إِلَى الْعَيْشِ فِي وِئَامٍ.",
      "answer": "所有人都追求和睦相处。",
      "explanation": "常与介词 فِي 连用，表示处于和睦状态。",
      "rubric": ["核心含义准确", "句法关系清晰", "中文自然，符合使用场景"]
    },
    {
      "id": "ceremony-choice",
      "knowledgeId": "ceremony",
      "type": "zh-ar",
      "prompt": "请选择“欢迎仪式”对应的阿语。",
      "options": [
        "مَرَاسِمُ الِاسْتِقْبَالِ",
        "حَرَسُ الشَّرَفِ",
        "الْعَلْمَانِيُّ"
      ],
      "answer": "مَرَاسِمُ الِاسْتِقْبَالِ",
      "explanation": "مَرَاسِم 是仪式、礼仪；与 رُسُوم（费用、图画）区分。"
    },
    {
      "id": "ceremony-translate",
      "knowledgeId": "ceremony",
      "type": "ar-zh",
      "prompt": "翻译：بَدَأَتْ مَرَاسِمُ الِاسْتِقْبَالِ فِي الصَّبَاحِ.",
      "answer": "欢迎仪式于上午开始。",
      "explanation": "正偏组合中，后项用属格；前项随句法位置变化。",
      "rubric": ["核心含义准确", "句法关系清晰", "中文自然，符合使用场景"]
    },
    {
      "id": "guard-choice",
      "knowledgeId": "guard",
      "type": "zh-ar",
      "prompt": "请选择“仪仗队”对应的阿语。",
      "options": ["حَرَسُ الشَّرَفِ", "زِيَارَةُ مُجَامَلَةٍ", "الْأَذَرِيُّ"],
      "answer": "حَرَسُ الشَّرَفِ",
      "explanation": "“检阅仪仗队”惯用 اِسْتَعْرَضَ حَرَسَ الشَّرَفِ。"
    },
    {
      "id": "guard-translate",
      "knowledgeId": "guard",
      "type": "ar-zh",
      "prompt": "翻译：اِسْتَعْرَضَ الرَّئِيسُ حَرَسَ الشَّرَفِ.",
      "answer": "总统检阅了仪仗队。",
      "explanation": "正偏组合中，后项用属格；前项随句法位置变化。",
      "rubric": ["核心含义准确", "句法关系清晰", "中文自然，符合使用场景"]
    },
    {
      "id": "courtesy-choice",
      "knowledgeId": "courtesy",
      "type": "zh-ar",
      "prompt": "请选择“礼节性拜访”对应的阿语。",
      "options": [
        "زِيَارَةُ مُجَامَلَةٍ",
        "الْعَلْمَانِيُّ",
        "تَكَاتُفُ الْجُهُودِ"
      ],
      "answer": "زِيَارَةُ مُجَامَلَةٍ",
      "explanation": "不要机械译成“恭维访问”；外交礼宾中指礼节性拜访。"
    },
    {
      "id": "courtesy-translate",
      "knowledgeId": "courtesy",
      "type": "ar-zh",
      "prompt": "翻译：قَامَ السَّفِيرُ بِزِيَارَةِ مُجَامَلَةٍ لِلْوَزِيرِ.",
      "answer": "大使对部长进行了礼节性拜访。",
      "explanation": "正偏组合中，后项用属格；前项随句法位置变化。",
      "rubric": ["核心含义准确", "句法关系清晰", "中文自然，符合使用场景"]
    },
    {
      "id": "prep",
      "knowledgeId": "courtesy",
      "type": "preposition",
      "prompt": "补全：قَامَ السَّفِيرُ ___ زِيَارَةِ مُجَامَلَةٍ",
      "answer": "بِ",
      "explanation": "قَامَ بِـ 表示进行、从事。",
      "options": ["بِ", "عَنْ", "إِلَى"]
    },
    {
      "id": "meaning",
      "knowledgeId": "harmony",
      "type": "ar-choice",
      "prompt": "الْوِئَامُ 的含义是？",
      "answer": "和睦",
      "explanation": "وِئَام 表示和睦、和谐。",
      "options": ["和睦", "竞争", "仪式"]
    },
    {
      "id": "fill",
      "knowledgeId": "guard",
      "type": "zh-fill",
      "prompt": "请写出“仪仗队”。",
      "answer": "حَرَسُ الشَّرَفِ",
      "explanation": "注意正偏组合中 الشَّرَفِ 为属格。",